<?xml version="1.0" encoding="utf-8" standalone="yes"?>

<rootmap
        xmlns="https://example.org/ROOTMAP/ScoreboardDataSchema"
        xmlns:xsi="http://www.w3.org/2001/XMLSchema-instance"
        xsi:schemaLocation="https://example.org/ROOTMAP/ScoreboardDataSchema https://rootmapstorageaccount.blob.core.windows.net/rootmap-schemata-container/ScoreboardData.xsd">
  <initialisation>
    <owner>Scoreboard</owner>
    <!-- Plant SharedAttributes -->
    <scoreboarddata>
      <process>PlantCoordinator</process>
      <characteristic>Growth Rate Max Plant 1 RootOrder0 VolumeObject 1</characteristic>
      <scheme>set scoreboard value=0.02;</scheme>
    </scoreboarddata>
    <scoreboarddata>
      <process>PlantCoordinator</process>
      <characteristic>Growth Rate Max Plant 1 RootOrder1 VolumeObject 1</characteristic>
      <scheme>set scoreboard value=0.006;</scheme>
    </scoreboarddata>
    <scoreboarddata>
      <process>PlantCoordinator</process>
      <characteristic>Growth Rate Max Plant 1 RootOrder2 VolumeObject 1</characteristic>
      <scheme>set scoreboard value=0.005;</scheme>
    </scoreboarddata>
    <scoreboarddata>
      <process>PlantCoordinator</process>
      <characteristic>Growth Rate Max Plant 1 RootOrder>=3 VolumeObject 1</characteristic>
      <scheme>set scoreboard value=0.003;</scheme>
    </scoreboarddata>
  </initialisation>
</rootmap>
