<?xml version="1.0" encoding="utf-8"?>
<!-- Soil P for modelling lupin root growth in pots, simulations in sandy soil -->
<rootmap
        xmlns="https://example.org/ROOTMAP/ScoreboardDataSchema"
        xmlns:xsi="http://www.w3.org/2001/XMLSchema-instance"
        xsi:schemaLocation="https://example.org/ROOTMAP/ScoreboardDataSchema https://rootmapstorageaccount.blob.core.windows.net/rootmap-schemata-container/ScoreboardData.xsd">
  <initialisation>
    <owner>Scoreboard</owner>
    <scoreboarddata>
      <!-- Added P µgP/g soil, top dressed fertiliser = P mixed through the top 3cm of soil -->-->
      <process>Phosphorus</process>
      <characteristic>Added P</characteristic>
      <scheme>
        set scoreboard value=0.0;
        set plane Z=1 value=399.8;
        set plane Z=2 value=399.8;
        set plane Z=3 value=399.8;
      </scheme>
    </scoreboarddata>
  </initialisation>

  <initialisation>
    <owner>Scoreboard</owner>
    <scoreboarddata>
      <process>Phosphorus</process>
      <!-- Total Labile P µgP/g in each soil cube, or µgP/mL for nutrient solution simulations-->
      <characteristic>Total Labile P</characteristic>
      <scheme>
        set scoreboard value=8.0;
      </scheme>
    </scoreboarddata>
  </initialisation>
</rootmap>
